Guillaume Ginolhac,Traitement STAP et Modélisation SIRV: Robustesse et Persymétrie Traitement STAP et Modélisation SIRV: Robustesse et Persymétrie,"JP Ovarlez, F Pascal, P Forster, G Ginolhac, M Mahot",,
Guillaume Ginolhac,ctorat,"L Ferro-Famil, G Ginolhac, JP Ovarlez, C Adnet, O Rabaste",,
Guillaume Ginolhac,Bornes de Cramér-Rao intrinsèques et matrices de covariance,"F Bouchard, A Breloy, G Ginolhac, A Renaux",,
Guillaume Ginolhac,HAL Id: hal-04234464,"O Lerda, A Mian, G Ginolhac, JP Ovarlez",,
Guillaume Ginolhac,EUSIPCO 2013 1569746601,"A Combernoux, F Pascal, G Ginolhac, M Lesturgie",,
Guillaume Ginolhac,"STAP à Rang Réduit, Robust et Persymétrique STAP à Rang Réduit, Robust et Persymétrique","G Ginolhac, P Forster, JP Ovarlez, F Pascal",,
Guillaume Ginolhac,"Signal-Adapted Tight Frames on Graphs....................... H. Behjat, U. Richter, D. Van De Ville, and L. Sörnmo 6017 Optimization Methods for Signal Processing Weighted ADMM …","G Gassier, G Chabriel, J Barrere, F Briolle, C Jauffret, A Breloy, ...",,
Guillaume Ginolhac,Nouvelles techniques d’imagerie pour le Radar à Synthèse d’Ouverture,"F Brigui, R Durand, G Ginolhac, L Thirion-Lefevre, P Forster",,
Guillaume Ginolhac,Imagerie radar multicapteur,"F Daout, F Schmitt, G Ginolhac, P Fargette",,
Guillaume Ginolhac,Cross HOSVD and covariance approach,"M Boizard, G Ginolhac, F Pascal, P Forster",,
Guillaume Ginolhac,Fusion algorithms for detection in presence of reverberation,"G Ginolhac, J Chanussot, C Pichat",,
Guillaume Ginolhac,Imagerie radar multistatique utilisant des émetteurs d’opportunité GPS,"F Maussang, F Daout, G Ginolhac, F Schmitt",,
