Patrick Lambert,L'avenir de la psychiatrie: rencontre avec Pierre Lambert,"P LAMBERT, J DUFOUR, C VASSEUR",,1995
Patrick Lambert,The modelization of Alosa alosa population dynamic in the Gironde-Garonne-Dordogne watershed,"D Martin, P Lambert, E Rochard, P Elie",,1995
Patrick Lambert,Allopolyploid and autopolyploid origins in Helianthus and related genera (Asteraceae) recognized bu conserved fragments: a method to disclose ancient genome,"K Sossey-Alaoui, E Schilling, H Serieys, M Tersac, P Lambert, A Bervillé",,1995
Patrick Lambert,Complete Sequence (20 Kilobases) of the Polyprotein-Encoding,"JF ELEOUET, D RASSCHAERT, P LAMBERT",,1995
Patrick Lambert,Reflexions d'un groupe de travail compose de,"O Bouvet, E Hantouche, P Lambert, P Moron, P Péron-Magnan, ...",,1994
Patrick Lambert,Applying the age estimation method to study the population of sturgeon (Acipenser sturio) in the Gironde estuary,"M Lepage, P Lambert, E Rochard",,1994
Patrick Lambert,Synthesis of modelisation concepts of migration phenomena of eel civelles (Anguilla anguilla) in estuary,P Lambert,,1994
Patrick Lambert,Genomic organization in Helianthus genus and sunflower,"K Alaoui-Sossey, P Lambert, H Serieys, M Tersac, A Bervillé, L Gentzbittel, ...",,1994
Patrick Lambert,"Synthesis of modelisation concepts of migration phenomena of eel civelles (Anguilla anguilla, L., 1758) in estuary.",P Lambert,,1994
Patrick Lambert,Etude de l'esturgeon Acipenser sturio dans le milieu naturel: application de la méthode d'estimation de l'age à l'analyse démographique de la population d'esturgeon Acipenser …,"M Lepage, P Lambert, E Rochard",,1993
Patrick Lambert,Development of an eel inventory technique by electric fishing: use of CSP and Cemagref's data,P Lambert,,1993
Patrick Lambert,Study of the sturgeon Acipenser sturio in the natural environment: application of the method of age estimation to the demographic analysis of the population of sturgeon …,"M Lepage, P Lambert, E Rochard",,1993
Patrick Lambert,"Flooding, soil occupancy and protection needs","G Oberlin, P Lambert",,1991
Patrick Lambert,Segmentation d'image couleur par coopération teinte-intensite,"P LAMBERT, H ROTIVAL, T CARRON, P BOLON",,1991
Patrick Lambert,Cavitation Erosion and Deformation Mechanisms of Nickel and Cobalt Austenitic Stainless Steels,"R Simoneau, P Lambert, M Simoneau, JI Dickson, G L'Esperance",,1987
Patrick Lambert,Propagation de signaux codes en phase: Application à la connaissance du milieu acoustique sous-marin,P LAMBERT,,1983
Patrick Lambert,Digital modular technology: Application to matched filtering,"J Lienard, J Jourdain, P Lambert",,1982
Patrick Lambert,Alteration de la phase dans une transmission en acoustique sous-marine,"JY JOURDAIN, P LAMBERT, G REVOL",,1981
Patrick Lambert,ERYTHROBLASTOPENIA AND THYMUS TUMOR. SURPRISING CORRECTION OF THE ANEMIA BY CORTICOTHERAPY,"M RADERMECKER, A OGER, L PH, Y MESSENS",,1964
Patrick Lambert,GENETIC RELATIONSHIPS BETWEEN APRICOT (Prunus armeniaca L.) AND RELATED SPECIES USING AFLP MARKERS ETUDE DES RELATIONS GENETIQUES ENTRE L'ABRICOTIER (Prunus armeniaca L.) ET …,"P Lambert, JM Audergon, B Khadari",,1963
Patrick Lambert,"Dissertation sur les bains d'eau douce, et leur emploi dans la pratique.(Cand. P. Lambert.).",P Lambert,,1806
Patrick Lambert,"Dissertation sur les bains d'eau douce, et leur emploi dans la pratique",P.. Lambert,,1806
Patrick Lambert,55 Life Histories of Anadromous Fishes,"ML Acolas, P Lambert",,
Patrick Lambert,Ecologie Comportementale et Biologie des Populations de Poissons,"L Beaulaton, A Acou, A Bardonnet, E Prévost, P Lambert",,
Patrick Lambert,LAMII zyxwvutsrqponmlkjihg,"J Chanussot, P Lambert",,
Patrick Lambert,Surprising Sun,"S Turck-Chize, S Couvidat, L Piau, J Ferguson, P Lambert, J Ballot, ...",,
Patrick Lambert,Assessing and enhancing ecosystem services provided by diadromous fishes in a climate change context,"A Murillas, A Muench, N Sainsbury, M Soliño, M Ashley, PR de Almeida, ...",,
Patrick Lambert,Knowledge and scales in eel management context. The case of the France and the Basin of Gironde-Garonne-Dordogne,"MJ Menozzi, C Barthélémy, P Lambert",,
Patrick Lambert,Etude de faisabilité d'expérimentations de systèmes de suivi d'UTI et d'échanges informatisés d'informations entre les acteurs de chaînes de transport multimodales,P Lambert,,
Patrick Lambert,Hilbert Based Video To Timed-Image Filling and Learning To Recognize Visual Violence,"A Abdourrahmane Mahamane, A BENOIT, P LAMBERT",,
Patrick Lambert,Van-Toi NGUYEN,P LAMBERT,,
Patrick Lambert,Analyse des données de captures d'anguilles par pêche électrique et cartographie des structures en tailles à l'échelle de la France: rapport final,P Lambert,,
Patrick Lambert,Project descriptors,"G Castelnaud, P Lambert, L Beaulaton, M Åström, H Wickström",,
Patrick Lambert,Post doctoral opportunity,"C Bordeaux, P Lambert",,
Patrick Lambert,"GlobAng, a model of eel population dynamics within a hydrographical network",P Lambert,,
Patrick Lambert,KSE 2016 program committee,"MH Abel, MB Aimar, A Alaei, N Aljohani, A Alzahrani, T Andrew, ...",,
Patrick Lambert,Dezvoltarea unui Algoritm de DetecŃie Automată a Scenelor de Actiune din filme,P LAMBERT,,
Patrick Lambert,"Committees vii Preface x Invited keynote talk and panel 1 Similarity Search in High Dimensional Spaces: Application to Multime-dia, Vincent Oria, New Jersey Institute of …","I Laptev, D Barthelemy, M Datcu, MR Generation, B Merialdo, D Charlet, ...",,
Patrick Lambert,Analyse Texte et Image pour la caractérisation de l’activité dans les Films d’Animation,"GPFDD Beauchêne, P Lambert",,
Patrick Lambert,La couleur dans les séquences d’images,"P Lambert, B Ionescu, D Coquin",,
Patrick Lambert,"3D video shot boundary detection based on clustering of depth-temporal features............... 1 Lino Ferreira, Pedro Assunção, Luis A. da Silva Cruz A Filtering Tool to …","I Mironică, B Ionescu, P Knees, P Lambert, C Penet, CH Demarty, ...",,
Patrick Lambert,"Esen, Ersin, 131","E Acar, S Albayrak, AM Alimi, M Allard, AB Ammar, L Amsaleg, ...",,
Patrick Lambert,A contour-color-action approach to automatic retrieval of several common video genres,"BE Ionescu, C Rasche, C Vertan, P Lambert",,
Patrick Lambert,CARACTERISATION DU MOUVEMENT DANS LES FILMS D’ANIMATION,"B IONESCU, P LAMBERT, D COQUIN, V BUZULOIU",,
