researcher,title,authors,value of cited by,year
Patrick Lambert,3-D deep learning approach for remote sensing image classification,"AB Hamida, A Benoit, P Lambert, CB Amar",702,2018
Patrick Lambert,"Color edge detector using jointly hue, saturation and intensity","T Carron, P Lambert",265,1994
Patrick Lambert,Fuzzy fusion techniques for linear features detection in multitemporal SAR images,"J Chanussot, G Mauris, P Lambert",235,1999
Patrick Lambert,Dynamic hand gesture recognition using the skeleton of the hand,"B Ionescu, D Coquin, P Lambert, V Buzuloiu",137,2005
Patrick Lambert,Total ordering based on space filling curves for multivalued morphology,"J Chanussot, P Lambert",117,1998
Patrick Lambert,Video summarization from spatio-temporal features,"R Laganière, R Bacco, A Hocevar, P Lambert, G Païs, BE Ionescu",78,2008
Patrick Lambert,Symbolic fusion of luminance-hue-chroma features for region segmentation,"P Lambert, T Carron",72,1999
Patrick Lambert,Extending mathematical morphology to color image processing,"P Lambert, J Chanussot",58,2000
Patrick Lambert,Filtering and segmentation: The specifity of color images,P Lambert,53,2000
Patrick Lambert,Bit mixing paradigm for multivalued morphological filters,"J Chanussot, P Lambert",47,1997
Patrick Lambert,An application of mathematical morphology to road network extraction on SAR images,"J Chanussot, P Lambert",38,1998
Patrick Lambert,PDE-based enhancement of color images in RGB space,"S Bettahar, AB Stambouli, P Lambert, A Benoit",35,2011
Patrick Lambert,Hierarchical late fusion for concept detection in videos,"ST Strat, A Benoit, P Lambert, H Bredin, G Quénot",32,2014
Patrick Lambert,Improved cut detection for the segmentation of animation movies,"B Ionescu, V Buzuloiu, P Lambert, D Coquin",32,2006
Patrick Lambert,Irim at TRECVID 2014: Semantic indexing and instance search,"N Ballas, B Labbé, H Le Borgne, P Gosselin, D Picard, M Redi, ...",30,2014
Patrick Lambert,Symbolic fusion of hue-chroma-intensity features for region segmentation,"T Carron, P Lambert",30,1996
Patrick Lambert,Using eigenvectors of a vector field for deriving a second directional derivative operator for color images,"W Alshatti, P Lambert",30,1993
Patrick Lambert,Deep learning for semantic segmentation of remote sensing images with rich spectral content,"AB Hamida, A Benoit, P Lambert, L Klein, CB Amar, N Audebert, ...",29,2017
Patrick Lambert,A fuzzy color-based approach for understanding animated movies content in the indexing task,"B Ionescu, D Coquin, P Lambert, V Buzuloiu",29,2008
Patrick Lambert,Timed-image based deep learning for action recognition in video sequences,"AM Atto, A Benoit, P Lambert",26,2020
Patrick Lambert,Fuzzy color edge extraction by inference rules quantitative study and evaluation of performances,"T Carron, P Lambert",26,1995
Patrick Lambert,Multiscale fully convolutional densenet for semantic segmentation,"S Brahimi, N Ben Aoun, C Ben Amar, A Benoit, P Lambert",21,2018
Patrick Lambert,Semantic segmentation using reinforced fully convolutional densenet with multiscale kernel,"S Brahimi, N Ben Aoun, A Benoit, P Lambert, C Ben Amar",20,2019
Patrick Lambert,Indexed operations for non-rectangular lattices applied to convolutional neural networks,"M Jacquemont, L Antiga, T Vuillaume, G Silvestri, A Benoit, P Lambert, ...",20,2019
Patrick Lambert,Deep Learning for automatic sale receipt understanding,"R Raoui-Outach, C Million-Rousseau, A Benoit, P Lambert",20,2017
Patrick Lambert,Content-based video description for automatic video genre categorization,"B Ionescu, K Seyerlehner, C Rasche, C Vertan, P Lambert",20,2012
Patrick Lambert,Rushes summarization by IRIM consortium: redundancy removal and multi-feature fusion,"G Quenot, J Benois-Pineau, B Mansencal, E Rossi, M Cord, F Precioso, ...",19,2008
Patrick Lambert,A quick and coarse color image segmentation,"P Lambert, H Grecu",19,2003
Patrick Lambert,Watershed approaches for color image segmentation.,"J Chanussot, P Lambert",19,1999
Patrick Lambert,First full-event reconstruction from imaging atmospheric cherenkov telescope real data with deep learning,"M Jacquemont, T Vuillaume, A Benoit, G Maurin, P Lambert, G Lamanna",18,2021
Patrick Lambert,GammaLearn: a Deep Learning framework for IACT data,"M Jacquemont, T Vuillaume, A Benoit, G Maurin, P Lambert, G Lamanna, ...",18,2019
Patrick Lambert,An audio-visual approach to web video categorization,"BE Ionescu, K Seyerlehner, I Mironică, C Vertan, P Lambert",18,2014
Patrick Lambert,Études méthodologiques du filtrage et de la segmentation d'images multi-composantes,P Lambert,18,2002
Patrick Lambert,Comparison of prefiltering operators for road network extraction in SAR images,"P Bolon, J Chanussot, I Issa, P Lambert",18,1999
Patrick Lambert,Deep learning approach for remote sensing image analysis,"AB Hamida, A Benoit, P Lambert, C Ben-Amar",17,2016
Patrick Lambert,Retina enhanced SIFT descriptors for video indexing,"ST Strat, A Benoit, P Lambert",17,2013
Patrick Lambert,Animation movie abstraction: Key frame adaptative selection based on color histogram filtering,"L Ott, P Lambert, B Ionescu, D Coquin",16,2007
Patrick Lambert,Irim at trecvid 2011: Semantic indexing and instance search,"B Delezoide, F Precioso, PH Gosselin, M Redi, B Merialdo, L Granjon, ...",15,2011
Patrick Lambert,IRIM at TRECVID 2010: semantic indexing and instance search,"D Gorisse, F Precioso, PH Gosselin, L Granjon, D Pellerin, M Rombaut, ...",15,2010
Patrick Lambert,Animation movies trailer computation,"B Ionescu, P Lambert, D Coquin, L Ott, V Buzuloiu",15,2006
Patrick Lambert,Retina enhanced SURF descriptors for spatio-temporal concept detection,"ST Strat, A Benoit, P Lambert, A Caplier",14,2014
Patrick Lambert,Color-based semantic characterization of cartoons,"B Ionescu, P Lambert, D Coquin, L Darlea",14,2005
Patrick Lambert,A color-action perceptual approach to the classification of animated movies,"B Ionescu, C Vertan, P Lambert, A Benoit",13,2011
Patrick Lambert,Image retrieval using spatial chromatic histograms,"P Lambert, N Hervey, H Grecu",13,2004
Patrick Lambert,An in-depth evaluation of multimodal video genre categorization,"I Mironică, B Ionescu, P Knees, P Lambert",12,2013
Patrick Lambert,Animated movie genre detection using symbolic fusion of text and image descriptors,"G Païs, P Lambert, D Beauchêne, F Deloule, B Ionescu",12,2012
Patrick Lambert,IRIM at TRECVID 2010: High level feature extraction and instance search,"D Gorisse, F Precioso, P Gosselin, L Granjon, D Pellerin, M Rombaut, ...",12,2010
Patrick Lambert,Analysis of the Cherenkov Telescope Array first Large-Sized Telescope real data using convolutional neural networks,"T Vuillaume, M Jacquemont, MB de Lavergne, DA Sanchez, V Poireau, ...",11,2021
Patrick Lambert,A contour-color-action approach to automatic classification of several common video genres,"BE Ionescu, C Rasche, C Vertan, P Lambert",11,2011
Patrick Lambert,A simple but effective approach to video copy detection,"G Roth, R Laganière, P Lambert, I Lakhmiri, T Janati",11,2010
Patrick Lambert,Color-Based Content Retrieval of Animation Movies: A Study.,"B Ionescu, P Lambert, D Coquin, V Buzuloiu",11,2007
Patrick Lambert,Real time vector median like filter: FPGA design and application to color image filtering,"J Chanussot, M Paindavoine, P Lambert",10,1999
Patrick Lambert,Dissolve detection in abstract video contents,"B Ionescu, C Vertan, P Lambert",9,2011
Patrick Lambert,Fuzzy semantic action and color characterization of animation movies in the video indexing task context,"BE Ionescu, D Coquin, P Lambert, V Buzuloiu",9,2006
Patrick Lambert,Multi-task architecture with attention for imaging atmospheric cherenkov telescope data analysis,"M Jacquemont, T Vuillaume, A Benoit, G Maurin, P Lambert",8,2021
Patrick Lambert,Retina enhanced bag of words descriptors for video classification,"ST Strat, A Benoit, P Lambert",8,2014
Patrick Lambert,Video genre categorization and representation using audio-visual information,"B Ionescu, K Seyerlehner, C Rasche, C Vertan, P Lambert",8,2012
Patrick Lambert,PDE-based efficient method for colour image restoration,"S Bettahar, P Lambert, AB Stambouli",7,2017
Patrick Lambert,The cut detection issue in the animation movie domain.,"B Ionescu, P Lambert, D Coquin, V Buzuloiu",7,2007
Patrick Lambert,Data fusion for the management of multimedia documents,"F Deloule, P Lambert, D Beauchene, B Ionescu",7,2007
Patrick Lambert,Enhancement and registration of multichannel images based on vector order filter,"P Lambert, S Gaspard",7,2000
Patrick Lambert,Integration of linguistic knowledge for colour image segmentation,"T Carron, P Lambert",7,1996
Patrick Lambert,A vector rank filter application to multi-spectral image filtering,"W Alshatti, P Bolon, P Lambert",7,1995
Patrick Lambert,Single imaging atmospheric cherenkov telescope full-event reconstruction with a deep multi-task learning architecture,"M Jacquemont, T Vuillaume, A Benoît, G Maurin, P Lambert",6,2020
Patrick Lambert,Image retrieval by partial queries,"H Grecu, P Lambert",6,2001
Patrick Lambert,Indexation par descripteurs flous: Application à la recherche d’images,"H GRECU, P LAMBERT",6,2001
Patrick Lambert,Fuzzy techniques evaluate sausage quality,"G Mauris, N Perrot, P Lambert, JR Philippe",6,2000
Patrick Lambert,Prétraitements des images couleur,"P Lambert, P Montesinos",6,1999
Patrick Lambert,Image processing makeup using fuzzy performance indicators,"P Lambert, G Mauris, A Elbou",6,1998
Patrick Lambert,IRIM at TRECVID 2018: Instance search,"B Mansencal, J Benois-Pineau, H Bredin, G Quénot",5,2018
Patrick Lambert,Deep learning vs spectral clustering into an active clustering with pairwise constraints propagation,"N Voiron, A Benoit, P Lambert, B Ionescu",5,2016
Patrick Lambert,Anisotropic color image denoising and sharpening,"S Bettahar, P Lambert, AB Stambouli",5,2014
Patrick Lambert,Spatio-temporal block model for video indexation assistance,"A Simac-Lejeune, M Rombaut, P Lambert",5,2010
Patrick Lambert,Relevance of interest points for eye position prediction on videos,"A Simac-Lejeune, S Marat, D Pellerin, P Lambert, M Rombaut, N Guyader",5,2009
Patrick Lambert,Highlighting action content in animated movies,"B Ionescu, A Pacureanu, P Lambert, C Vertan",5,2009
Patrick Lambert,Fuzzy color-based semantic characterization of animation movies,"B Ionescu, P Lambert, D Coquin, V Buzuloiu",5,2006
Patrick Lambert,GammaLearn-first steps to apply Deep Learning to the Cherenkov Telescope Array data,"T Vuillaume, J Mikael, L Antiga, A Benoit, P Lambert, G Maurin, G Silvestri",4,2019
Patrick Lambert,IRIM at TRECVid 2015: semantic indexing,"H Le Borgne, P Gosselin, D Picard, M Redi, B Mérialdo, B Mansencal, ...",4,2015
Patrick Lambert,Points d'intérêt spatio-temporels pour la détection de mouvements dans les vidéos,"A Simac-Lejeune, M Rombaut, P Lambert",4,2010
Patrick Lambert,Tackling action-based video abstraction of animated movies for video browsing,"B Ionescu, L Ott, P Lambert, D Coquin, A Pacureanu, V Buzuloiu",4,2010
Patrick Lambert,An Approach to Scene Detection in Animation Movies and its Applications,"B Ionescu, D Coquin, P Lambert, V Buzuloiu",4,2005
Patrick Lambert,Segmentation automatique des images couleur à base d'indicateurs de performance,"N Bouloudani, P Lambert, D Coquin",4,2003
Patrick Lambert,Simplification of a color image segmentation using a fuzzy attributed graph,"H Grecu, P Lambert",4,2000
Patrick Lambert,Représentation floue et graphe d'adjacence pour la simplification d'images segmentées: Application à l'Indexation,"H Grecu, P Lambert",4,1999
Patrick Lambert,The characterization of new austenitic stainless steels highly resistant to cavitation-erosion,"G L'Esperance, M Simoneau, P Lambert, JI Dickson, R Simoneau",4,1990
Patrick Lambert,Semi-supervised Spectral Clustering with automatic propagation of pairwise constraints,"N Voiron, A Benoit, A Filip, P Lambert, B Ionescu",3,2015
Patrick Lambert,A Fisher Kernel Approach for Multiple Instance Based Object Retrieval in Video Surveillance,"I MIRONICĂ, CA MITREA, B Ionescu, P Lambert",3,2015
Patrick Lambert,Bags of Trajectory Words for video indexing,"ST Strat, A Benoit, P Lambert",3,2014
Patrick Lambert,Intensity-driven dissolve detection adapted to synthetic video contents,"B Ionescu, P Lambert",3,2013
Patrick Lambert,Automatic difference measure between movies using dissimilarity measure fusion and rank correlation coefficients,"N Voiron, A Benoit, P Lambert",3,2012
Patrick Lambert,Reconnaissance de gestes dynamiques de la main,"B Ionescu, D Coquin, P Lambert",3,2003
Patrick Lambert,Entrelacement de bits et Space Filling Curves: une extension des filtres de rang aux images couleur,"J CHANUSSOT, P LAMBERT",3,1997
Patrick Lambert,"Deep learning for astrophysics, understanding the impact of attention on variability induced by parameter initialization","M Jacquemont, T Vuillaume, A Benoit, G Maurin, P Lambert",2,2021
Patrick Lambert,Deep learning for semantic segmentation,"A Benoit, B Ghattas, E Amri, J Fournel, P Lambert",2,2021
Patrick Lambert,Generative Adversarial Network (GAN) for remote sensing images unsupervised learning,"AB Hamida, A Benoit, P Lambert, CB Amar",2,2018
Patrick Lambert,Classification of animated video genre using color and temporal information,"B Ionescu, P Lambert",2,2013
Patrick Lambert,Enhancement of multi-valued images using PDE coupling,"S Bettahar, AB Stambouli, P Lambert, A Benoit",2,2011
Patrick Lambert,"Classifying documentary, music, news and animated genres with temporal, color and contour information","B Ionescu, C Rasche, L Florea, C Vertan, P Lambert",2,2011
Patrick Lambert,Numerical scheme for efficient colour image denoising,"S Bettahar, AB Stambouli, P Lambert",2,2011
Patrick Lambert,Similarity measurement for animation movies,"A Benoit, M Ciobotaru, P Lambert, B Ionescu",2,2011
Patrick Lambert,Animated movie activity characterization by image and text information fusion,"G Pais, F Deloule, D Beauchêne, P Lambert",2,2009
Patrick Lambert,Fast color image segmentation using fuzzy clustering,"P Lambert, H Grecu",2,2002
Patrick Lambert,A software instrument using fuzzy techniques for sausage quality evaluation,"G Mauris, N Perrot, P Lambert, JR Philippe",2,2000
Patrick Lambert,Analyse d'une segmentation en regions utilisant conjointement les informations de chrominance et d'intensite,"T Carron, P Lambert, P Morel",2,1993
Patrick Lambert,Contribution par l'étude de la phase transmise à la modélisation du milieu acoustique sous-marin,P Lambert,2,1983
Patrick Lambert,Transmission acoustique de signaux monochromatiques,"JY Jourdain, P Lambert",2,1980
Patrick Lambert,Lecture automatique d'un ticket de caisse par vision embarquee sur un telephone mobile,"R Raoui-Outach, C Million-Rousseau, A Benoit, P Lambert",1,2016
Patrick Lambert,Yellow eel stock assessment oriented by the colonisation process to evaluate impacts of obstacles,"P Lambert, H Drouineau, C Briand, L Beaulaton",1,2014
Patrick Lambert,Analyse de trajectoires pour l'indexation sémantique des vidéos à grande échelle,"ST Strat, A Benoit, P Lambert",1,2014
Patrick Lambert,Un indicateur de fausses couleurs pour évaluer le traitement des images couleurs,"I Varian, P Lambert, S Bettahar",1,2013
Patrick Lambert,Retina-enhanced surf descriptors for semantic concept detection in videos,"ST Strat, A Benoit, P Lambert, A Caplier",1,2012
Patrick Lambert,A content-driven system architecture for tackling automatic cataloging of animated movie databases,"B Ionescu, A Marin, P Lambert, D Coquin, C Vertan",1,2012
Patrick Lambert,Analyzing Animated Movie Contents for Automatic Video Indexing,"B Ionescu, P Lambert, D Coquin, A Marin, C Vertan",1,2011
Patrick Lambert,Audio-Visual content description for video genre classification in the context of social media.,"B Ionescu, K Seyerlehner, C Vertan, P Lambert",1,2011
Patrick Lambert,Pyramiding mono and polygenic resistances is one strategy to provide lasting control of the resistance to the green peach aphid and powdery mildew in peach,"P Lambert, MH Sauge, JL Poëssel, T Pascal",1,2008
Patrick Lambert,Virtual experiments: the estuarine migration of glass eel with an individual-based model,"P Lambert, A Sottolichio, N Dumoulin",1,2005
Patrick Lambert,Ontologies et indexations vidéo pour les films d'animation,"D Beauchêne, F Deloule, I Bogdan, P Lambert",1,2005
Patrick Lambert,Influence de la Réduction des Couleurs sur la Détection des Changements de Plan dans les Films d’Animation,"B IONESCU, P LAMBERT, D COQUIN, V BUZULOIU",1,2005
Patrick Lambert,STATIC HAND GESTURE RECOGNITION SYSTEM,"B Ionescu, D Coquin, P Lambert, V Buzuloiu",1,2004
Patrick Lambert,Image processing using fuzzy techniques for sausage quality evaluation,"P Lambert, G Mauris, N Perrot",1,2001
Patrick Lambert,Détection de failles géologiques par traitement morphologique multi-spectral,"J Chanussot, P Lambert, G Vidal, E Trouvé",1,1999
Patrick Lambert,Mise au point d'une technique d'inventaire de l'anguille par pêche électrique: exploitation des données CSP et CEMAGREF,P Lambert,1,1993
Patrick Lambert,Un opérateur optimal pour la détection de contours dans des images couleur,"W ALSHATTI, P LAMBERT",1,1993
Patrick Lambert,Deep‐learning Analysis of Cherenkov Telescope Array Images,"M JACQUEMONT, T VUILLAUME, A BENOIT, G MAURIN, P LAMBERT",,2024
Patrick Lambert,Quel enseignement de l’écologie à l’école?,"S Turpin, B Castagneyrol, M Dagens, D Dessagne, M Farina, AF Gibert, ...",,2021
Patrick Lambert,Content-based multimedia indexing (CBMI 2018)[SI 1104],"R Péteri, G Quénot, P Joly",,2021
Patrick Lambert,Reproduction and Adaptation: A Definition of the Thermal Niche of Spawning for a French Metapopulation of Allis Shad in a Global Warming Context,"A Paumier, H Drouineau, L Carry, P Lambert",,2018
Patrick Lambert,La grande alose adopte une tactique de ponte efficace pour optimiser la survie de la descendance,"P Lambert, P Jatteau, A Paumier, L Carry, H Drouineau, MLEP FRA",,2018
Patrick Lambert,Hilbert Based Video To Timed-Image Filling and Learning To Recognize Visual Violence,"AM ATTO, A Benoît, P Lambert",,2018
Patrick Lambert,Sélection génomique-Quelles perspectives chez les Prunus?,"M N'sibi, C Confolent, P Lambert, S Bureau, B Gouble, A Blanc, G Roch, ...",,2017
Patrick Lambert,Assessing the impact of anthropogenic pressures on temperate eels using Genetics & Evolutionary ecology-based model for eels (GenEveel),"M Mateo, P Lambert, S Tétard, H Drouineau",,2017
Patrick Lambert,Could Multimedia approaches help Remote Sensing Analysis?,"AB Hamida, A Benoit, P Lambert, C Ben-Amar",,2015
Patrick Lambert,Clustering Spectral semi-supervisé avec propagation des contraintes par paires,"N Voiron, A Benoit, A Filip, P Lambert, B Ionescu",,2015
Patrick Lambert,Preface to the special issue on Content-Based Multimedia Indexing,"S Marchand-Maillet, P Lambert, B Mérialdo, J Benois-Pineau",,2014
Patrick Lambert,Control of chilling requirement and flowering time in trees; linking genetics and genomics to understand these complex phenological traits in deciduous fruit and forest trees,"AG Abbott, S Mariette, L Andreini, T Zhebentyayeva, Z Liu, G Roch, ...",,2014
Patrick Lambert,Suivi par échographie de la maturation sexuelles des anguilles argentées,"S Bureau Du Colombier, L Jacobs, C Gesset, P Elie, P Lambert",,2014
Patrick Lambert,"Passé, présent et future de l'alose vraie, Alosa alosa, évalués par une approche de dynamique de population en deux étapes","T Rougier, H Drouineau, G Lassalle, E Rochard, P Lambert",,2014
Patrick Lambert,Evaluation du stock d'anguilles jaunes orientée par le processus de colonisation pour mesurer l'impact des obstacles,"P Lambert, H Drouineau, C Briand, L Beaulaton",,2014
Patrick Lambert,Science pour la gestion des pêcheries de civelles: comment définir les TAC en France?,"L Beaulaton, P Lambert, E Prévost, A Bardonnet",,2014
Patrick Lambert,Monitoring of sexual maturation in silver eels using ultrasonography,"S Bureau Du Colombier, L Jacobs, C Gesset, P Elie, P Lambert",,2014
Patrick Lambert,"Past, present and future of the Allis shad, Alosa alosa, assessed by a two-step population dynamics approach","T ROUGIER, H Drouineau, G Lassalle, E Rochard, P Lambert",,2014
Patrick Lambert,New advances on the flesh's red pigmentation in peach,"T Pascal, S Bureau, L Heurtevin, JB Mauroux, C Confolent, P Lambert, ...",,2014
Patrick Lambert,A visual-based late-fusion framework for video genre classification,"I Mironică, B Ionescu, C Rasche, P Lambert",,2013
Patrick Lambert,Molecular assisted selection (MAS): a promising approach under development in peach breeding,"P Lambert, E Dirlewanger, B Quilot-Turion, M Troggio, D Micheletti, ...",,2013
Patrick Lambert,Genetic variability study in a wide germplasm of domesticated peach through high throughput genotyping,"D Micheletti, V Aramini, P Arus, E Banchi, T Barreneche, D Bassi, ...",,2013
Patrick Lambert,Genetic Variability Study in a Wide Germplasm of Domesticated Peach Through High Throughput,"D Micheletti, V Aramini, P Arus, E Banchi, T Barreneche, D Bassi, ...",,2013
Patrick Lambert,Characterization and genetic mapping of a new blood-flesh trait controlled by the single dominant locus DBF in peach.,"SZJ Shen ZhiJun, C Confolent, P Lambert, JL Poëssel, B Quilot-Turion, ...",,2013
Patrick Lambert,New insights on blood-flesh determinants in peach,"T Pascal, C Confolent, P Lambert, JL Poëssel, B Quilot-Turion, Z Shen",,2013
Patrick Lambert,"Estimations des possibilités de captures totales d'anguilles de moins de 12 cm pour les saisons 2012-2013, 2013-2014 et 2014-2015","L Beaulaton, P Lambert, A Bardonnet",,2013
Patrick Lambert,Identification et marquage des facteurs génétiques de résistance à la Sharka chez l’abricotier et le Prunus davidiana,"D Tricon, P Lambert, JM Audergon, T Pascal, G Roch, V Decroocq",,2013
Patrick Lambert,Identification et marquage des facteurs génétiques de résistance à la Sharka chez l’abricotier et le Prunus davidiana,"P Lambert, JM Audergon, T Pascal, G Roch, V Decroocq",,2013
Patrick Lambert,Identification and tagging of genetic resistance factors to Sharka disease in apricot trees and Prunus davidiana,"D Tricon, P Lambert, JM Audergon, T Pascal, G Roch, V Decroocq",,2013
Patrick Lambert,La subsidiarité à l'oeuvre dans une politique européenne; le cas du règlement anguilles,"MJ Menozzi, C Barthelemy, P Lambert",,2013
Patrick Lambert,Behavioural experiments on young of year European sturgeon (Acipenser sturio) intended for stocking ADAPTEST (ADAPTability TESTs),"ML Acolas, C Gesset, R Fraty, L Jacobs, P Lambert, E Rochard",,2013
Patrick Lambert,Semantic concept detection using dense codeword motion,"C Tănase, B Mérialdo",,2013
Patrick Lambert,IRIM-Indexation et Recherche d'Information Multimedia GDR-ISIS,"N Ballas, B Labbé, A Shabou, H Le Borgne, P Gosselin, M Redi, ...",,2012
Patrick Lambert,AUTOMATICWEB VIDEO CATEGORIZATION USING AUDIO-VISUAL INFORMATION AND HIERARCHICAL CLUSTERING RELEVANCE FEEDBACK,"B Ionescu, K Seyerlehner, I Mironica, C Vertan, P Lambert",,2012
Patrick Lambert,Automatic web video categorization using audio-visual information and hierarchical clustering RF,"B Ionescu, K Seyerlehner, I Mironica, C Vertan, P Lambert",,2012
Patrick Lambert,2012 10th International Workshop on Content-Based Multimedia Indexing (CBMI),"F Annecy, P Lambert, LP Annecy-Chambery",,2012
Patrick Lambert,Le modèle EDA (Eel Density Analysis) pour estimer l'échappement des anguilles argentées dans un réseau hydrographique à partir de données disponibles sur les stocks en place,"C Jouanin, C Briand, L Beaulaton, P Lambert",,2012
Patrick Lambert,"Synthèse du programme de conservation d'Acipenser sturio en France depuis 2007: Production de juvéniles, expérimentations, lâché suivi dans le milieu naturel","ML Acolas, E Rochard, P Chèvre, P Jatteau, C Gesset, N Delage, ...",,2012
Patrick Lambert,Rapport sur le stock et la pêche de l'anguille en France 2011-2012,"L Beaulaton, C Briand, G Castelnaud, MN De Casamajor, P Lambert, ...",,2012
Patrick Lambert,EDA model (Eel Density Analysis) to assess silver eels escapement in a river network from data available from stocks.,"C Jouanin, C Briand, L Beaulaton, P Lambert",,2012
Patrick Lambert,Colinisation and use of estuarine habitats by catadromous fish species: comparison between Seine and Gironde,"J Coustillas, J Cachot, C Le Pichon, H Budzinski, P Lambert, M Bunel, ...",,2012
Patrick Lambert,Peach molecular breeding at the INRA Avignon and links to a new European initiative to increase fruit breeding efficiency: FP7 KBBE FruitBreedomics,P Lambert,,2012
Patrick Lambert,Identification of genomic regions and candidate genes involved in fruit ripening in two apricot (Prunus armeniaca L.) cultivars,"P Lambert, D Ruiz, B Gouble, S Bureau, L Buendia, M Reich, P Reling, ...",,2012
Patrick Lambert,Colonisation et utilisation des habitats estuariens par les poissons migrateurs thalassotoques: approche comparative Seine-Gironde,"J Coustillas, J Cachot, C Le Pichon, H Budzinski, P Lambert, M Bunel, ...",,2012
Patrick Lambert,Développement d’outils de modélisation de la population d’anguille européenne prenant en compte la diversité des paramètres de dynamique par grande fraction d’aire de …,P Lambert,,2012
Patrick Lambert,Report on the eel stock and fishery in France 2011-2012,"L Beaulaton, C Briand, G Castelnaud, MN De Casamajor, P Lambert, ...",,2012
Patrick Lambert,"Overview of the Acipenser sturio conservation program in France since 2007: Juvenile production, laboratory experiments, stocking and monitoring in the natural environment","ML Acolas, E Rochard, P Chèvre, P Jatteau, C Gesset, N Delage, ...",,2012
